============================================================
🔄 CONSENSUS ROUND #3
============================================================
📡 Transaction propagated by 6 nodes:
   node_0 → node_17: 83.56 tokens
   📈 node_8: FlowScore +1 → 19.0
   📈 node_21: FlowScore +1 → 19.0
   📈 node_12: FlowScore +1 → 21.0
   📈 node_3: FlowScore +1 → 22.0
   📈 node_4: FlowScore +1 → 27.0
   📈 node_1: FlowScore +1 → 21.0
📡 Transaction propagated by 9 nodes:
   node_15 → node_10: 56.31 tokens
   📈 node_12: FlowScore +1 → 22.0
   📈 node_13: FlowScore +1 → 17.0
   📈 node_22: FlowScore +1 → 18.0
   📈 node_19: FlowScore +1 → 21.0
   📈 node_6: FlowScore +1 → 22.0
   📈 node_17: FlowScore +1 → 17.0
   📈 node_0: FlowScore +1 → 14.0
   📈 node_24: FlowScore +1 → 20.0
   📈 node_2: FlowScore +1 → 21.0
📡 Transaction propagated by 10 nodes:
   node_7 → node_2: 5.31 tokens
   📈 node_19: FlowScore +1 → 22.0
   📈 node_3: FlowScore +1 → 23.0
   📈 node_23: FlowScore +1 → 17.0
   📈 node_17: FlowScore +1 → 18.0
   📈 node_5: FlowScore +1 → 12.0
   📈 node_10: FlowScore +1 → 23.0
   📈 node_15: FlowScore +1 → 17.0
   📈 node_18: FlowScore +1 → 21.0
   📈 node_0: FlowScore +1 → 15.0
   📈 node_2: FlowScore +1 → 22.0
📡 Transaction propagated by 9 nodes:
   node_10 → node_1: 45.8 tokens
   📈 node_9: FlowScore +1 → 22.0
   📈 node_15: FlowScore +1 → 18.0
   📈 node_10: FlowScore +1 → 24.0
   📈 node_21: FlowScore +1 → 20.0
   📈 node_14: FlowScore +1 → 19.0
   📈 node_5: FlowScore +1 → 13.0
   📈 node_3: FlowScore +1 → 24.0
   📈 node_23: FlowScore +1 → 18.0
   📈 node_7: FlowScore +1 → 18.0
📡 Transaction propagated by 9 nodes:
   node_10 → node_19: 61.1 tokens
   📈 node_7: FlowScore +1 → 19.0
   📈 node_18: FlowScore +1 → 22.0
   📈 node_17: FlowScore +1 → 19.0
   📈 node_13: FlowScore +1 → 18.0
   📈 node_8: FlowScore +1 → 20.0
   📈 node_2: FlowScore +1 → 23.0
   📈 node_10: FlowScore +1 → 25.0
   📈 node_12: FlowScore +1 → 23.0
   📈 node_11: FlowScore +1 → 17.0
📡 Transaction propagated by 9 nodes:
   node_10 → node_8: 36.5 tokens
   📈 node_22: FlowScore +1 → 19.0
   📈 node_14: FlowScore +1 → 20.0
   📈 node_9: FlowScore +1 → 23.0
   📈 node_23: FlowScore +1 → 19.0
   📈 node_6: FlowScore +1 → 23.0
   📈 node_18: FlowScore +1 → 23.0
   📈 node_8: FlowScore +1 → 21.0
   📈 node_5: FlowScore +1 → 14.0
   📈 node_16: FlowScore +1 → 15.0
📡 Transaction propagated by 5 nodes:
   node_5 → node_14: 40.28 tokens
   📈 node_21: FlowScore +1 → 21.0
   📈 node_1: FlowScore +1 → 22.0
   📈 node_24: FlowScore +1 → 21.0
   📈 node_11: FlowScore +1 → 18.0
   📈 node_10: FlowScore +1 → 26.0
📡 Transaction propagated by 10 nodes:
   node_3 → node_9: 76.4 tokens
   📈 node_13: FlowScore +1 → 19.0
   📈 node_19: FlowScore +1 → 23.0
   📈 node_20: FlowScore +1 → 19.0
   📈 node_22: FlowScore +1 → 20.0
   📈 node_18: FlowScore +1 → 24.0
   📈 node_24: FlowScore +1 → 22.0
   📈 node_10: FlowScore +1 → 27.0
   📈 node_6: FlowScore +1 → 24.0
   📈 node_17: FlowScore +1 → 20.0
   📈 node_23: FlowScore +1 → 20.0
📡 Transaction propagated by 5 nodes:
   node_2 → node_1: 10.05 tokens
   📈 node_14: FlowScore +1 → 21.0
   📈 node_5: FlowScore +1 → 15.0
   📈 node_17: FlowScore +1 → 21.0
   📈 node_19: FlowScore +1 → 24.0
   📈 node_10: FlowScore +1 → 28.0
📡 Transaction propagated by 9 nodes:
   node_22 → node_19: 25.05 tokens
   📈 node_21: FlowScore +1 → 22.0
   📈 node_23: FlowScore +1 → 21.0
   📈 node_0: FlowScore +1 → 16.0
   📈 node_14: FlowScore +1 → 22.0
   📈 node_24: FlowScore +1 → 23.0
   📈 node_22: FlowScore +1 → 21.0
   📈 node_10: FlowScore +1 → 29.0
   📈 node_13: FlowScore +1 → 20.0
   📈 node_11: FlowScore +1 → 19.0
📡 Transaction propagated by 10 nodes:
   node_8 → node_2: 17.74 tokens
   📈 node_22: FlowScore +1 → 22.0
   📈 node_21: FlowScore +1 → 23.0
   📈 node_10: FlowScore +1 → 30.0
   📈 node_20: FlowScore +1 → 20.0
   📈 node_17: FlowScore +1 → 22.0
   📈 node_13: FlowScore +1 → 21.0
   📈 node_15: FlowScore +1 → 19.0
   📈 node_7: FlowScore +1 → 20.0
   📈 node_4: FlowScore +1 → 28.0
   📈 node_6: FlowScore +1 → 25.0
📡 Transaction propagated by 6 nodes:
   node_16 → node_2: 46.66 tokens
   📈 node_17: FlowScore +1 → 23.0
   📈 node_24: FlowScore +1 → 24.0
   📈 node_22: FlowScore +1 → 23.0
   📈 node_21: FlowScore +1 → 24.0
   📈 node_14: FlowScore +1 → 23.0
   📈 node_7: FlowScore +1 → 21.0
📡 Transaction propagated by 5 nodes:
   node_18 → node_9: 14.88 tokens
   📈 node_20: FlowScore +1 → 21.0
   📈 node_4: FlowScore +1 → 29.0
   📈 node_3: FlowScore +1 → 25.0
   📈 node_5: FlowScore +1 → 16.0
   📈 node_16: FlowScore +1 → 16.0
📡 Transaction propagated by 6 nodes:
   node_12 → node_0: 85.55 tokens
   📈 node_5: FlowScore +1 → 17.0
   📈 node_11: FlowScore +1 → 20.0
   📈 node_13: FlowScore +1 → 22.0
   📈 node_22: FlowScore +1 → 24.0
   📈 node_20: FlowScore +1 → 22.0
   📈 node_14: FlowScore +1 → 24.0
📡 Transaction propagated by 5 nodes:
   node_10 → node_2: 90.09 tokens
   📈 node_19: FlowScore +1 → 25.0
   📈 node_10: FlowScore +1 → 31.0
   📈 node_12: FlowScore +1 → 24.0
   📈 node_8: FlowScore +1 → 22.0
   📈 node_23: FlowScore +1 → 22.0
📡 Transaction propagated by 7 nodes:
   node_0 → node_12: 83.86 tokens
   📈 node_20: FlowScore +1 → 23.0
   📈 node_13: FlowScore +1 → 23.0
   📈 node_3: FlowScore +1 → 26.0
   📈 node_16: FlowScore +1 → 17.0
   📈 node_10: FlowScore +1 → 32.0
   📈 node_8: FlowScore +1 → 23.0
   📈 node_2: FlowScore +1 → 24.0
📡 Transaction propagated by 6 nodes:
   node_19 → node_16: 44.45 tokens
   📈 node_20: FlowScore +1 → 24.0
   📈 node_18: FlowScore +1 → 25.0
   📈 node_21: FlowScore +1 → 25.0
   📈 node_13: FlowScore +1 → 24.0
   📈 node_2: FlowScore +1 → 25.0
   📈 node_5: FlowScore +1 → 18.0
📡 Transaction propagated by 8 nodes:
   node_12 → node_17: 2.71 tokens
   📈 node_3: FlowScore +1 → 27.0
   📈 node_23: FlowScore +1 → 23.0
   📈 node_13: FlowScore +1 → 25.0
   📈 node_21: FlowScore +1 → 26.0
   📈 node_18: FlowScore +1 → 26.0
   📈 node_4: FlowScore +1 → 30.0
   📈 node_10: FlowScore +1 → 33.0
   📈 node_16: FlowScore +1 → 18.0
📡 Transaction propagated by 9 nodes:
   node_17 → node_3: 95.52 tokens
   📈 node_13: FlowScore +1 → 26.0
   📈 node_21: FlowScore +1 → 27.0
   📈 node_16: FlowScore +1 → 19.0
   📈 node_18: FlowScore +1 → 27.0
   📈 node_11: FlowScore +1 → 21.0
   📈 node_3: FlowScore +1 → 28.0
   📈 node_17: FlowScore +1 → 24.0
   📈 node_0: FlowScore +1 → 17.0
   📈 node_19: FlowScore +1 → 26.0
📡 Transaction propagated by 5 nodes:
   node_11 → node_22: 10.98 tokens
   📈 node_14: FlowScore +1 → 25.0
   📈 node_17: FlowScore +1 → 25.0
   📈 node_19: FlowScore +1 → 27.0
   📈 node_0: FlowScore +1 → 18.0
   📈 node_11: FlowScore +1 → 22.0
📡 Transaction propagated by 7 nodes:
   node_16 → node_13: 15.19 tokens
   📈 node_13: FlowScore +1 → 27.0
   📈 node_5: FlowScore +1 → 19.0
   📈 node_1: FlowScore +1 → 23.0
   📈 node_0: FlowScore +1 → 19.0
   📈 node_22: FlowScore +1 → 25.0
   📈 node_16: FlowScore +1 → 20.0
   📈 node_2: FlowScore +1 → 26.0
📡 Transaction propagated by 5 nodes:
   node_4 → node_7: 53.14 tokens
   📈 node_16: FlowScore +1 → 21.0
   📈 node_7: FlowScore +1 → 22.0
   📈 node_1: FlowScore +1 → 24.0
   📈 node_15: FlowScore +1 → 20.0
   📈 node_23: FlowScore +1 → 24.0
📡 Transaction propagated by 5 nodes:
   node_12 → node_23: 43.31 tokens
   📈 node_23: FlowScore +1 → 25.0
   📈 node_13: FlowScore +1 → 28.0
   📈 node_9: FlowScore +1 → 24.0
   📈 node_12: FlowScore +1 → 25.0
   📈 node_20: FlowScore +1 → 25.0
📡 Transaction propagated by 7 nodes:
   node_22 → node_24: 77.01 tokens
   📈 node_3: FlowScore +1 → 29.0
   📈 node_13: FlowScore +1 → 29.0
   📈 node_23: FlowScore +1 → 26.0
   📈 node_9: FlowScore +1 → 25.0
   📈 node_8: FlowScore +1 → 24.0
   📈 node_4: FlowScore +1 → 31.0
   📈 node_20: FlowScore +1 → 26.0
📡 Transaction propagated by 8 nodes:
   node_4 → node_14: 53.01 tokens
   📈 node_20: FlowScore +1 → 27.0
   📈 node_0: FlowScore +1 → 20.0
   📈 node_2: FlowScore +1 → 27.0
   📈 node_5: FlowScore +1 → 20.0
   📈 node_3: FlowScore +1 → 30.0
   📈 node_9: FlowScore +1 → 26.0
   📈 node_17: FlowScore +1 → 26.0
   📈 node_15: FlowScore +1 → 21.0
📡 Transaction propagated by 7 nodes:
   node_8 → node_13: 76.72 tokens
   📈 node_4: FlowScore +1 → 32.0
   📈 node_3: FlowScore +1 → 31.0
   📈 node_1: FlowScore +1 → 25.0
   📈 node_24: FlowScore +1 → 25.0
   📈 node_22: FlowScore +1 → 26.0
   📈 node_21: FlowScore +1 → 28.0
   📈 node_23: FlowScore +1 → 27.0
📡 Transaction propagated by 8 nodes:
   node_13 → node_9: 42.76 tokens
   📈 node_15: FlowScore +1 → 22.0
   📈 node_13: FlowScore +1 → 30.0
   📈 node_10: FlowScore +1 → 34.0
   📈 node_9: FlowScore +1 → 27.0
   📈 node_2: FlowScore +1 → 28.0
   📈 node_0: FlowScore +1 → 21.0
   📈 node_12: FlowScore +1 → 26.0
   📈 node_6: FlowScore +1 → 26.0
📡 Transaction propagated by 5 nodes:
   node_2 → node_7: 95.91 tokens
   📈 node_18: FlowScore +1 → 28.0
   📈 node_4: FlowScore +1 → 33.0
   📈 node_10: FlowScore +1 → 35.0
   📈 node_16: FlowScore +1 → 22.0
   📈 node_12: FlowScore +1 → 27.0

 COMMITTEE SELECTION PROCESS
----------------------------------------
 VRF Seed: 0e9c52fd3a94cc05...
👥 Committee selected (5 members):
   👑 LEADER node_18: ticket=03c1f5fe... score=28.0 weight=5.29
   👤 Member node_5: ticket=0b4afea5... score=20.0 weight=4.47
   👤 Member node_15: ticket=15d310b8... score=22.0 weight=4.69
   👤 Member node_16: ticket=192794d3... score=22.0 weight=4.69
   👤 Member node_9: ticket=506fe417... score=27.0 weight=5.20

🔨 BLOCK CREATION BY LEADER node_18
----------------------------------------
📦 Block #3 created
    Transactions: 20
   🔗 Previous hash: 0e9c52fd3a94cc05...
   🆔 Block hash: 65689cd1221fd0c0...

🗳️  COMMITTEE VOTING PROCESS
----------------------------------------
   ✅ node_18: APPROVE (sig: b77a5d040c2ce11b)
   ✅ node_5: APPROVE (sig: 95bf957e49a786f2)
   ✅ node_15: APPROVE (sig: c4e16ee5266986b0)
   ✅ node_16: APPROVE (sig: 35b37dd4e886d274)
   ✅ node_9: APPROVE (sig: 044933929e7f6bdb)

📊 Voting Results:
   ✅ Approvals: 5/5
   📋 Required: 4
    Consensus: ✅ REACHED

 BLOCK #3 FINALIZED
    Finality time: 0.00s
    Signatures: 5 BLS aggregated

💰 REWARD DISTRIBUTION
   👑 Leader node_18: 0.1200 tokens
   👥 Each committee member: 0.0160 tokens

📈 NETWORK STATUS
----------------------------------------
📊 Performance Metrics:
   🚀 Current TPS: 5.97
   📦 Blocks created: 3
    Total transactions: 89
   ️  Average finality: ~1.5s

 Top 5 Nodes by FlowScore:
   1. node_10: 35.0 points (weight: 5.92)
   2. node_4: 33.0 points (weight: 5.74)
   3. node_3: 31.0 points (weight: 5.57)
   4. node_13: 30.0 points (weight: 5.48)
   5. node_21: 28.0 points (weight: 5.29)

️  Pausing for 3 seconds...